review_text,stars
"Never been in - but I get pizza delivered from them now and then. I am a New Yorker and to call me a pizza snob probably doesn't go far enough.

The crust is crispy, thin, and foldable, the outside edges, crispy and bubbly. Great mozzarella. I have never been disappointed by a topping. A little greasy, as it should be; it reminds me of NY pizza, and that's a big compliment coming from me.

We don't have a Ray's in Central Phoenix... but we do have Mamma Mia's. 

Yo! Tony! You make a good pizza.",4
"I was really surprised by this place!  Soooo much better than that other ""bertos"" place!  I went thru the drive thru so I'm not sure about the inside but I ordered the taco and cheese enchilada combo with rice and beans. I also ordered a side of chips. The food was very good and the rice was REALLY good!  The chips were hot!!  Loved it!  Yum!  I will be back when I'm in the area again.",4
"I am not a beer drinker, so this is not rating the beer, but the food and atmosphere.

1) Atmosphere: sweet - great patio and nice bar scene inside

2) Food - pretty good for bar food

3) Hit it up if you are in Tempe, its just one of those places you need to go",4
"I have seen this place for years and years but had never gone in until one night awhile ago.  It turned out to be a really cool bar with live music and great drink specials.

It's a small place, but what it lacks in size, it makes up in character.  It has a vibe all its own and if you get there early, you can sit right up front and check out the band. 

Do something different and go to Char's, you'll be glad you did.",4
"More a comment than a review. Suffice it to say, I L-O-V-E this store! Much to my surprise and delight they are opening a second store at 75th and Cactus! Right in my own backyard , don't ya know. Woo hoo! Now all we need for the NW valley is Lee's sandwiches, and a solid dim sum joint to complete my favorite Asian trifecta!!",4
The best tai in downtown for the price! Masiman is the most tasty dish here!,5
"After reading many decent reviews and seeing how close the restaurant was to home, I decided to give it a try.

The young lady at the counter was impatient and had no interpersonal skills. The food was just not good; this place is 'Chinese take-out' at best.",2
Great food and very friendly service.  Happy to recommend!,5
Good & fast food. Prices are fair. They charge a fee for Bank cards.,4
"How can something so simple taste sooo good? I wish there were one more on the west side. I hate going to the fair to get my fix of fry bread. There needs to be one of these on every  corner of the compass in Phoenix! As Rachel Ray would say, ""Yummy!""",5
"we come here about once a week. the soup in a bread bowl is yummy- i usually get a wildflower salad with the pesto vinegarette, which is amazing! their grain mustard is also amazing and the service is usually very good. the clientele can be interesting so it is a good place to people watch :)",4
Great hh prices. Like to go and unwind. Definetly give it a try,4
I love that this restaurant can accommodate  all types of people. It's a sports bar with Family style entertainment! The staff is always friendly and  they aim to please. The food is always good and prices are very reasonable. The bar is on one side so it splits the Families with children on the other side with an amazing area with tvs to play Xbox and wii. Check this place out. You won't be disappointed.,5
"Since I moved to AZ from Los Angeles I have been searching far and wide for a sushi place that met my high standards for great sushi. Sakana is hands down the best in town. The fish is fresh, the rolls are huge and nothing beats the .50 cent appetizers when you buy a beer! I recommend going on a weeknight, Friday and Saturday nights can fill up pretty quickly so you might have to wait.... but it's worth it.",5
"Bad ass, just like the name.  I've heard that this facility doesn't have any water restrictions so their course is lush & in tip top shape.  It's definitely a challenging course.  The staff is nice and the current off season rate is  $35 for residents!  You have to check it out, it's a great deal.",5
Great food!  The FEZ burger is a real winner.  The staff and clientele are friendly.  Great place to meet people for drinks and hang out.,4
"My wife and I were downtown with some friends, and decided to check this place out. I ordered a pasta lunch, and chose Penne Alla Campagna and another penne with tomatoes and Mozzarella. Meh, it was just okay. The food was just okay, kind of bland and a bit overpriced. I did snag a small slice of pepperoni pizza from one of the kids at our table that was actually the best part of my meal. Would I go back, nope no sir",2
"This is the second time we visited India Gate. The service was as good as the last time we were there. The waiters are attentive and friendly, willing to explain in detail what and how each dishes were made (for those of us who has no idea what some of the items are on the menu)

Cozy place to have a nice meal, reasonable price.",4
Had lunch here with Robyn N. and Rand H. the food here was ok and I liked it better before they did the so called renovation.All they did was add a mongolian BBQ and wash the windows. Some of my favorite things on the buffet were gone so I am dropping them down to 3 stars but still it was a good lunch.,3
"basically, i'm only reviewing this store because i really do not care for the employees here. there are a few nice ones, but overall, they are either cranky, stressed out, or missing.

the redeeming points? a nice selection of crafting products. but then again, you can always just go to a DIFFERENT location. i'd opt for that.",2
